{"apiVersion":"kernel-zero.dev/evidence/v1","exceptionBundleDigest":null,"findings":[{"exceptionId":null,"fingerprint":"sha256:987389f998c50baf89cd73abf1d7684418e6d40c91a1415e6a3823168b88b9f5","id":"sha256:f8cf545e8a6b8032b96bf42fcbf89b71f9d52f70177a034c56be52e607c61410","level":"error","location":{"endColumn":1,"endLine":9,"startColumn":1,"startLine":9},"message":"A workflow step uses an action reference the policy does not accept as pinned.","messageCode":"ACTION_NOT_PINNED","path":".github/workflows/ci.yml","ruleId":"pinned-actions","subject":"action:actions/checkout@v4"}],"generatedAt":"2026-01-15T12:00:00.000Z","integrity":{"algorithm":"sha256","digest":"sha256:189df730499f6e016d86697a0528f564b7588841e5c786253e325cdba3cda0a5"},"kind":"WorkflowEvidence","policy":{"digest":"sha256:1111111111111111111111111111111111111111111111111111111111111111","name":"workflow-hygiene","revision":1},"result":{"durationMs":25,"errors":1,"excepted":0,"filesScanned":1,"status":"fail","warnings":0},"runId":"0195f000-0000-7000-8000-000000000001","signature":null,"subject":{"manifestDigest":"sha256:1111111111111111111111111111111111111111111111111111111111111111","repository":"example/service","revision":"git:0123456789abcdef0123456789abcdef01234567"},"tool":{"name":"kernel-zero-workflow","version":"1.0.0"},"workspace":"0195f000-0000-7000-8000-000000000002"}
